Detailed image,Category,Бренд,Product code,Название,Артикул,Описание,Гарантия,Производитель
,,,,,,,,
"RZ06-01970100-R3G1/1.png///RZ06-01970100-R3G1/2.png///RZ06-01970100-R3G1/3.png///RZ06-01970100-R3G1/4.png///RZ06-01970100-R3G1/5.png///RZ06-01970100-R3G1/6.png///RZ06-01970100-R3G1/7.png///RZ06-01970100-R3G1/8.png///RZ06-01970100-R3G1/9.jpg///RZ06-01970100-R3G1/10.png///RZ06-01970100-R3G1/11.jpg///RZ06-01970100-R3G1/12.png///RZ06-01970100-R3G1/13.jpg///RZ06-01970100-R3G1/14.jpg
",Девайсы///Геймпады,Razer,RZ06-01970100-R3G1,Razer Raiju,RZ06-01970100-R3G1,"Когда речь заходит об игровой консоли, контроллер становится мощнейшим оружием из вашего арсенала. Все компоненты Razer Raiju для PlayStation® 4 оптимизированы для того, чтобы дать вам максимально возможное преимущество, начиная с четырех дополнительных полностью программируемых кнопок и заканчивая формой и весом контроллера, не говоря уже о панели быстрой настройки. Этот непревзойденный контроллер, сделанный из исключительно прочных материалов и тщательно протестированный поклонниками киберспорта, позволит вам доминировать в игре.

Чтобы обеспечить бесспорный игровой комфорт, было сделано обширное исследование, и несколько вариантов этого контроллера были тщательно протестированы известными киберспортсменами. В результате Razer Raiju получил корпус, в который не только прекрасно встроена сенсорная панель, но и который получился удобным для использования в самых напряженных сражениях. 

Четыре дополнительные полностью программируемые кнопки для индивидуальной настройки раскладок управления
У Razer Raiju четыре многофункциональные кнопки: два бампера по бокам и два съемных триггера на нижней стороне. К этим кнопкам можно в индивидуальном порядке привязывать любые функции контроллера, благодаря чему вы получаете абсолютную свободу создания удобных настроек для достижения победы в игре.

Эргономичные форма и вес, разработанные в сотрудничестве с ведущими киберспортсменами
Чтобы обеспечить бесспорный игровой комфорт, было сделано обширное исследование, и несколько вариантов этого контроллера были тщательно протестированы известными киберспортсменами. В результате Razer Raiju получил корпус, в который не только прекрасно встроена сенсорная панель, но и который получился удобным для использования в самых напряженных сражениях.

Панель быстрой настройки профиля и параметров звука
Панель быстрой настройки предоставляет легкий доступ к целому ряду функций, позволяя переключаться между профилями, настраивать громкость и отключать микрофон. Удобное расположение между рукоятками помогает вам легко переключать предпочтительные параметры, не убирая рук с контроллера.

Усиленные материалы для непревзойденной надежности
Многофункциональные триггеры, выполненные из авиационного алюминия, и аналоговые стики из высокоуглеродистой стали позволяют Razer Raiju сохранять непревзойденную надежность. Этот контроллер прекрасно подходит для любого стиля игры, несмотря на степень ее экстремальности.

Стопоры триггеров и режим шнеллера для быстрой стрельбы
Razer Raiju оснащен стопорами триггеров, которые созданы для сокращения хода каждого триггера c 18 до всего лишь 5 градусов. Это невероятное снижение более чем на 70%. Вместе с Режимом шнеллера, повышающим чувствительность триггеров, вы можете легко выполнять свои действия в быстрой последовательности.

Совмещенный 3,5 мм разъем под стереозвук и микрофон
Razer Raiju оснащен 3,5 мм разъемом, который позволяет подключить вашу гарнитуру к стереовыходу и общаться с другими игроками из своей команды.

Официально лицензированный контроллер
Razer Raiju стал результатом партнерства с Sony Interactive Entertainment Europe (SIEE), также его созданию помогло близкое сотрудничество с киберспортсменами, активно испытывавшими прототипы. В результате официально лицензированный контроллер без проблем работает со всеми системами PS4™ и выдает производительность профессионального уровня.
Технические характеристики
Официально лицензированный контроллер для PS4™
Тачпад (сенсорная панель)
2 боковых многофункциональных бампера на базе технологии Hyperesponse
2 съёмных многофункциональных триггера на базе технологии Hyperesponse
4 кнопки действия ABXY на базе технологии Hyperesponse
4 кнопки панели быстрых настроек (Переназначения, Профили, Микрофон, Управление звуком игры и чата)
Дополнительные стопоры триггеров для скорострельного огня
Дополнительный режим мгновенного срабатывания триггеров (режим шнеллера)
Аудио разъем 3.5 мм для аудио и микрофона
Формованные резиновые рукоятки для удобного обхвата ладонью
Дополнительные нескользящие колпачки для аналоговых стиков
Чехол для переноски
Отсоединяемый облегченный кабель длиной 3 м, в защитной оплётке, с разъёмом Micro-USB
Размеры: 168 мм (Длина) x 105 мм (Ширина) x 65 мм (Высота)
Вес (с кабелем): 350 г
Комплектация
Игровой геймпад Razer Raiju
Чехол для переноски
Отвертка
Съемный кабель в оплетке
Разрывной кабель
2 дополнительных резиновых пупырчатых колпачка для аналоговых стиков
Информация об устройстве
",2 года,Китай
RZ06-01690100-R3G1/1.png///RZ06-01690100-R3G1/2.png///RZ06-01690100-R3G1/3.png///RZ06-01690100-R3G1/4.png///RZ06-01690100-R3G1/5.png///RZ06-01690100-R3G1/6.png///RZ06-01690100-R3G1/7.png///RZ06-01690100-R3G1/8.png,Девайсы///Геймпады,Razer,RZ06-01690100-R3G1,Razer Panthera,RZ06-01690100-R3G1,"Взяв за основу многолетний опыт профессиональных геймеров, участвующих в аркадных и консольных играх, и приняв во внимание мнение сообщества Razer, мы создали аркадный джойстик Razer Panthera. Пройдя через бесчисленное множество прототипов и тщательное бета-тестирование, мы довели его до совершенства, сохранив в джойстике возможность расширенной модификации, к которой геймеры и модмейкеры привыкли за последние годы. Помимо быстрого доступа к внутренним отсекам в одно нажатие кнопки вы получаете возможность полностью заменить джойстик и все 10 кнопок, чтобы добавить джойстику индивидуальности.

Благодаря фирменным компонентам Sanwa™ и раскладке Vewlix этот совершенный аркадный джойстик турнирного уровня стал воплощением надежности и точности. Razer Panthera закалялся в пламени аркадной классики. Он рожден для драк.

Высококачественные аппаратные компоненты Sanwa
В основе Razer Panthera лежит боевая машина турнирного класса, созданная для того, чтобы повысить ваше мастерство. Используя элитные аппаратные компоненты Sanwa — 10 кнопок с высокой скоростью отклика и 8-позиционный джойстик повышенной точности — вы сможете из раза в раз брать противника скоростью и точностью, стабильно демонстрируя максимальную эффективность в игре.

Широкие возможности модификации
Razer Panthera создан для тех, кто любит повозиться с настройкой: вы можете легко добраться до внутренних компонентов джойстика и модифицировать их под себя. Джойстик и кнопки можно адаптировать в зависимости от стиля игры. Более того, нижняя часть внутреннего отсека выполнена таким образом, что ее можно крепить винтами к любому основанию.

Внутренние отсеки для хранения
Одним нажатием кнопки вы открываете внутренний отсек Razer Panthera, где находятся специальные слоты для хранения съемного кабеля, входящего в комплект, вытянутой насадки на джойстик и отвертки. Здесь также хватит места для двух дополнительных кнопок. Мы позаботились о том, чтобы вы, отправляясь на турнир, могли взять все необходимое с собой.

Турнирный игровой режим
Характеристики Razer Panthera включают турнирный игровой режим и позволяют отключить кнопки Пуск/Опции, Выбрать/Поделиться, а также кнопки PlayStation, предупреждая случайное нажатие в ходе игры. Тем самым вас не дисквалифицируют в критические моменты турнирных матчей. Играйте спокойно, сюрпризов не предвидится.

Максимальная совместимость с основными файтинг играми
Razer Panthera отлично подходит для большинства популярных игр в жанре рукопашного боя. Теперь вам достаточно выбрать игру, чтобы оказаться в аркаде и начать побеждать противника.

Оптимизированный вес с резиновой основой, предотвращающей скольжение
Широкий профиль и вес Razer Panthera специально разработаны, чтобы джойстик был идеально сбалансированным и более комфортным, когда он находится на коленях, сводя к минимуму напряжение геймера, в то время как резиновая основа не позволяет джойстику соскальзывать в пылу сражений.

Технические характеристики

10 кнопок турнирного уровня производства Sanwa (Sanwa Denshi™)
Фирменный джойстик Sanwa с шарообразной насадкой
Легкий доступ в одно касание к внутренним компонентам и внутренним отсекам для хранения
Внутренняя компоновка в виде сот — простой монтаж с помощью отвертки
Отсек для хранения альтернативной насадки на джойстик и других элементов
Съемный USB-кабель (4 метра) с надежным винтовым креплением
Широкое резиновое основание для прочной фиксации контроллера на столе или коленях
Отвертка в комплекте
Комплектация
Аркадный джойстик Razer Panthera для PlayStation®4
Отсоединяемый кабель в оплетке длиной 4 метра
Разрывной кабель (breakaway cable)
1 отвертка с 2 наконечниками – плоским и крестовым
Шарообразная насадка на джойстик
Вытянутая насадка на джойстик
Системные требования
PlayStation®3 / PlayStation®4 *
ПК (Windows 7 и выше) **
Свободный порт USB",2 года,Китай
RZ06-01690200-R3G1/1.png///RZ06-01690200-R3G1/2.png///RZ06-01690200-R3G1/3.png///RZ06-01690200-R3G1/4.png///RZ06-01690200-R3G1/5.png///RZ06-01690200-R3G1/6.png///RZ06-01690200-R3G1/7.png,Девайсы///Геймпады,Razer,RZ06-01690200-R3G1,Razer Panthera Street Fighter V,RZ06-01690200-R3G1,"Взяв за основу многолетний опыт профессиональных геймеров, участвующих в аркадных и консольных играх, и приняв во внимание мнение сообщества Razer, мы создали аркадный джойстик Razer Panthera Street Fighter V. Пройдя через бесчисленное множество прототипов и тщательное бета-тестирование, мы довели его до совершенства, сохранив в джойстике возможность расширенной модификации, к которой геймеры и модмейкеры привыкли за последние годы. Помимо быстрого доступа к внутренним отсекам в одно нажатие кнопки вы получаете возможность полностью заменить джойстик и все 10 кнопок, чтобы добавить джойстику индивидуальности.

Благодаря фирменным компонентам Sanwa™ и раскладке Vewlix этот совершенный аркадный джойстик турнирного уровня стал воплощением надежности и точности. Razer Panthera Street Fighter V закалялся в пламени аркадной классики. Он рожден для драк.

Высококачественные аппаратные компоненты Sanwa
В основе Razer Panthera Street Fighter V лежит боевая машина турнирного класса, созданная для того, чтобы повысить ваше мастерство. Используя элитные аппаратные компоненты Sanwa — 10 кнопок с высокой скоростью отклика и 8-позиционный джойстик повышенной точности — вы сможете из раза в раз брать противника скоростью и точностью, стабильно демонстрируя максимальную эффективность в игре.

Широкие возможности модификации
Razer Panthera Street Fighter V создан для тех, кто любит повозиться с настройкой: вы можете легко добраться до внутренних компонентов джойстика и модифицировать их под себя. Джойстик и кнопки можно адаптировать в зависимости от стиля игры. Более того, нижняя часть внутреннего отсека выполнена таким образом, что ее можно крепить винтами к любому основанию.

Внутренние отсеки для хранения
Одним нажатием кнопки вы открываете внутренний отсек Razer Panthera Street Fighter V, где находятся специальные слоты для хранения съемного кабеля, входящего в комплект, вытянутой насадки на джойстик и отвертки. Здесь также хватит места для двух дополнительных кнопок. Мы позаботились о том, чтобы вы, отправляясь на турнир, могли взять все необходимое с собой.

Турнирный игровой режим
Характеристики Razer Panthera Street Fighter V включают турнирный игровой режим и позволяют отключить кнопки Пуск/Опции, Выбрать/Поделиться, а также кнопки PlayStation, предупреждая случайное нажатие в ходе игры. Тем самым вас не дисквалифицируют в критические моменты турнирных матчей. Играйте спокойно, сюрпризов не предвидится.

Максимальная совместимость с основными файтинг играми
Razer Panthera Street Fighter V отлично подходит для большинства популярных игр в жанре рукопашного боя. Теперь вам достаточно выбрать игру, чтобы оказаться в аркаде и начать побеждать противника.

Оптимизированный вес с резиновой основой, предотвращающей скольжение
Широкий профиль и вес Razer Panthera Street Fighter V специально разработаны, чтобы джойстик был идеально сбалансированным и более комфортным, когда он находится на коленях, сводя к минимуму напряжение геймера, в то время как резиновая основа не позволяет джойстику соскальзывать в пылу сражений.

Технические характеристики
10 кнопок турнирного уровня производства Sanwa (Sanwa Denshi™)
Фирменный джойстик Sanwa с шарообразной насадкой
Легкий доступ в одно касание к внутренним компонентам и внутренним отсекам для хранения
Внутренняя компоновка в виде сот — простой монтаж с помощью отвертки
Отсек для хранения альтернативной насадки на джойстик и других элементов
Съемный USB-кабель (4 метра) с надежным винтовым креплением
Широкое резиновое основание для прочной фиксации контроллера на столе или коленях
Отвертка в комплекте
Комплектация
Аркадный джойстик Razer Panthera для PlayStation®4
Отсоединяемый кабель в оплетке длиной 4 метра
Разрывной кабель (breakaway cable)
1 отвертка с 2 наконечниками – плоским и крестовым
Шарообразная насадка на джойстик
Вытянутая насадка на джойстик
Системные требования
PlayStation®3 / PlayStation®4 *
ПК (Windows 7 и выше) **
Свободный порт USB",2 года,Китай
