Detailed image,Category,Бренд,Product code,Название,Артикул,Описание,Материал покрытия,Материал основания,Размер,Дополнительные функции
"RZ02-00920100-R3M1/1.jpg///RZ02-00920100-R3M1/2.png
",Девайсы///Коврики для мыши,Razer,RZ02-00920100-R3M1,Razer Manticor,RZ02-00920100-R3M1,"Алюминиевый коврик для мыши Razer Manticor демонстрирует новый уровень непревзойденного дизайна и технологии, обеспечивая невероятно легкое скольжение для вашей игровой мыши. Razer Manticor выполнен из цельной пластины авиационного алюминия, а поверхность коврика имеет специальное покрытие, которое обеспечивает абсолютную точность и плавность перемещения мыши. Его угольно-черная отделка была специально выбрана после продолжительного тестирования, поскольку черный цвет лучше всего подходит для надежной работы сенсора. В результате вы сможете мгновенно реагировать метким хедшотом столкнувшись с противником лицом к лицу.

Оптимизированное покрытие
Специально разработанная микроскопическая текстура поверхности коврика для мыши Razer Manticor обеспечивает наиболее точную и постоянную работу сенсора. Используя этот коврик, вы забудете о срывах сенсора и проблемах гладкого скольжения.

Прочный монолитный алюминиевый корпус
Модель Razer Manticor выполнена из цельной пластины авиационного алюминия. Плоское и гладкое основание обеспечивает комфортное гладкое скольжение. В то же время, молекулярное взаимодействие, возникающее в результате специальной механической обработки, создает высокопрочную структуру, которая обеспечивает максимальную прочность. В процессе пескоструйной обработки создается текстура, которая способствует точности наведения и позволяет вам насладиться каждым движением мыши.

Тонкий и широкий
Коврик для мыши Razer Manticor настолько тонкий, что он практически сливается с поверхностью стола. Благодаря этому вы можете перемещать мышь, не беспокоясь о возможных сбоях при выходе за пределы коврика. Такой подход является также более эргономичным: нагрузка на запястье снижается, а значит, вы можете продолжать свои победоносные действия в игре гораздо дольше.
",Алюминий,Резина,"355 x 255 x 2,2 мм",Коврик из анодированного алюминия
"RZ02-01940100-R3M1/1.png///RZ02-01940100-R3M1/2.png///RZ02-01940100-R3M1/3.png///RZ02-01940100-R3M1/4.png///RZ02-01940100-R3M1/5.png///RZ02-01940100-R3M1/6.png///RZ02-01940100-R3M1/7.png///RZ02-01940100-R3M1/8.png///RZ02-01940100-R3M1/9.png
",Девайсы///Коврики для мыши,Razer,RZ02-01940100-R3M1,Razer Sphex V2,RZ02-01940100-R3M1,"Игровой коврик Razer Sphex V2 спроектирован для безупречной игры за настольным компьютером. Этот сверхтонкий игровой коврик обеспечивает высокое качество отслеживания как для лазерных, так и для оптических игровых мышек. Игровой коврик выполнен из сверхпрочного поликарбоната и усовершенствованного материала липкой подложки. Его характеристики и расположение останутся неизменными в ходе самого интенсивного игрового процесса, чтобы ваше внимание было сфокусировано исключительно на игре.

Для безупречной работы за настольным компьютером
Игровой коврик Razer Sphex V2 спроектирован для игроков, предпочитающих играть на абсолютно ровной горизонтальной поверхности. Его толщина составляет менее половины миллиметра. Благодаря сверхтонкой форме и усовершенствованному материалу липкой подложки этот игровой коврик станет превосходным выбором для игроков, предпочитающих игровой процесс без каких-либо помех.

Спроектирован для лазерных и оптических сенсоров
Игровой коврик Razer Sphex V2 спроектирован для повышения качества работы компьютерной мыши, демонстрации всех возможностей как оптических, так и лазерных сенсоров, обеспечения скорости и контроля любого стиля игры.

Максимальная прочность
Сверхпрочное покрытие из поликарбоната игрового коврика Razer Sphex V2 протестировано в лабораторных условиях на устойчивость к ударной нагрузке, разрывам и износу. Невероятная прочность обеспечит великолепные результаты в самых интенсивных тренировках и на турнирах.
",Поликарбонат,Поликарбонат,"355 x 254 x 0,5 мм","Сверхтонкая поверхность 0,5 мм. Многоразовый липкий слой основания. Превосходное качество отслеживания как для лазерных, так и для оптических мышей"
"RZ02-01940200-R3M1/1.png///RZ02-01940200-R3M1/10.png///RZ02-01940200-R3M1/2.png///RZ02-01940200-R3M1/3.png///RZ02-01940200-R3M1/4.png///RZ02-01940200-R3M1/5.png///RZ02-01940200-R3M1/6.png///RZ02-01940200-R3M1/7.png///RZ02-01940200-R3M1/8.png///RZ02-01940200-R3M1/9.png
",Девайсы///Коврики для мыши,Razer,RZ02-01940200-R3M1,Razer Sphex V2 Mini,RZ02-01940200-R3M1,"Игровой коврик Razer Sphex V2 спроектирован для безупречной игры за настольным компьютером. Этот сверхтонкий игровой коврик обеспечивает высокое качество отслеживания как для лазерных, так и для оптических игровых мышек. Игровой коврик выполнен из сверхпрочного поликарбоната и усовершенствованного материала липкой подложки. Его характеристики и расположение останутся неизменными в ходе самого интенсивного игрового процесса, чтобы ваше внимание было сфокусировано исключительно на игре.

Для безупречной работы за настольным компьютером
Игровой коврик Razer Sphex V2 спроектирован для игроков, предпочитающих играть на абсолютно ровной горизонтальной поверхности. Его толщина составляет менее половины миллиметра. Благодаря сверхтонкой форме и усовершенствованному материалу липкой подложки этот игровой коврик станет превосходным выбором для игроков, предпочитающих игровой процесс без каких-либо помех.

Спроектирован для лазерных и оптических сенсоров
Игровой коврик Razer Sphex V2 спроектирован для повышения качества работы компьютерной мыши, демонстрации всех возможностей как оптических, так и лазерных сенсоров, обеспечения скорости и контроля любого стиля игры.

Максимальная прочность
Сверхпрочное покрытие из поликарбоната игрового коврика Razer Sphex V2 протестировано в лабораторных условиях на устойчивость к ударной нагрузке, разрывам и износу. Невероятная прочность обеспечит великолепные результаты в самых интенсивных тренировках и на турнирах.
",Поликарбонат,Поликарбонат,"270 x 215 x 0,5 мм","Сверхтонкая поверхность 0,5 мм. Многоразовый липкий слой основания. Превосходное качество отслеживания как для лазерных, так и для оптических мышей"
"RZ02-01820200-R3M1/1.png///RZ02-01820200-R3M1/2.png///RZ02-01820200-R3M1/3.png///RZ02-01820200-R3M1/4.png///RZ02-01820200-R3M1/5.png
",Девайсы///Коврики для мыши,Razer,RZ02-01820200-R3M1,Razer Goliathus Mobile,RZ02-01820200-R3M1,"Что делать, когда ты играешь не дома? Так сложно не сдавать позиций без привычных игровых приспособлений. Представляем Razer Goliathus Mobile – мобильный коврик для игровой мыши. Идеальное соотношение контроля и скорости. Высочайшая точность считывания движений. И вся эта роскошь — в мобильном исполнении. Коврик получился очень легким. Толщина — всего лишь 1,5 мм. Такой не занимает много места в чемодане, сумке или рюкзаке. Позвольте себе небольшое преимущество на чужой территории.

Тонкий и гибкий — максимальная мобильность
Razer Goliathus Mobile, при толщине всего 1,5 мм, можно запросто всегда носить с собой. Можно, к примеру, вложить его внутрь ноутбука или свернуть трубочкой и сунуть в сумку, не боясь, что он потом не развернется.

Баланс контроля и скорости
Когда проектируешь коврик для геймеров, которые всегда в разъездах, важно соблюсти баланс, чтобы один и тот же коврик подходил для разных стилей игры. В результате обширных исследований и практических испытаний родился Razer Goliathus Mobile — его гладкая поверхность обеспечивает и быстрое скольжение, и точность остановки для контроля в игре.

Оптимальная поверхность для точного отслеживания движений
Razer Goliathus Mobile был создан благодаря пристальному вниманию к деталям. Микротекстура тканой поверхности отлично подходит как для оптических, так и для лазерных мышек. Это идеальная поверхность для турниров, где важно точное отслеживание движений. Малейшее перемещение будет замечено и с точностью скопировано на экран.
",Ткань,Резина,"215 x 270 x 1,5 мм","Оптимальный размер для мобильного использования
Прорезиненное основание для оптимального комфорта"
"RZ02-01820500-R3M1/1.png///RZ02-01820500-R3M1/2.png///RZ02-01820500-R3M1/3.png///RZ02-01820500-R3M1/4.png///RZ02-01820500-R3M1/5.png///RZ02-01820500-R3M1/6.png///RZ02-01820500-R3M1/7.png///RZ02-01820500-R3M1/8.png///RZ02-01820500-R3M1/9.png
",Девайсы///Коврики для мыши,Razer,RZ02-01820500-R3M1,Razer Goliathus Mobile Stealth,RZ02-01820500-R3M1,"Представляем мобильный коврик для мыши Razer Goliathus Mobile Stealth Edition, обеспечивающий высокочувствительное управление во время игр и высокую производительность.

При толщине всего лишь 1,5 мм коврик имеет невероятно гибкую поверхность, благодаря чему его легко брать с собой, куда бы вы не шли. Вы всегда будете иметь явное преимущество перед соперником, даже находясь в дороге.

Ультратонкий — толщиной всего лишь 1,5 мм
Благодаря тонкой форме, коврик Razer Goliathus Mobile Stealth Edition невероятно просто носить с собой. Он такого же размера, как и коврик Razer Goliathus Small, к тому же исключительно долговечный. Можно вложить этот коврик для мыши между экраном и клавиатурой ноутбука или свернуть его в трубочку и положить в сумку, не боясь, что он потом не развернется.

Идеальное соотношение контроля и скорости
Придерживаясь строгих стандартов лучших киберспортсменов, коврик Razer Goliathus Mobile Stealth Edition обладает поверхностью, которая дает вам точность для фокусировки на мелких деталях, так и скорость для быстрого переключения между несколькими окнами.

Сверхтонкая микротекстурная ткань для превосходного отслеживания
Поверхность со сверхтонким микротекстурным переплетением, созданная специально для турниров, где важно точное отслеживание движений. Мельчайшее движение мыши будет с точностью передано на экран.
",Ткань,Резина,"215 x 270 x 1,5 мм","Текстурированная тканевая отделка для превосходного баланса между скоростью и контролем игрового процесса
Оптимальный размер для мобильного использования"
"RZ02-01830200-R3M1/1.png///RZ02-01830200-R3M1/10.png///RZ02-01830200-R3M1/2.png///RZ02-01830200-R3M1/3.png///RZ02-01830200-R3M1/4.png///RZ02-01830200-R3M1/5.png///RZ02-01830200-R3M1/6.png///RZ02-01830200-R3M1/7.png///RZ02-01830200-R3M1/8.png///RZ02-01830200-R3M1/9.png
",Девайсы///Коврики для мыши,Razer,RZ02-01830200-R3M1,Razer Gigantus,RZ02-01830200-R3M1,"На киберспортивных турнирах геймеры должны продемонстрировать свои лучшие способности, и они не ожидают меньшего от тех девайсов, которые сами используют. Киберспортивный коврик для мыши Razer Gigantus был полностью создан на основе отзывов профессионалов из Team Razer. У Razer Gigantus очень большая поверхность, специальное игровое покрытие и оптимальная толщина, поэтому вы будете на шаг впереди своих соперников на протяжении всего марафона.

Очень большая поверхность для мышек с низкой чувствительностью
Обидно, когда коврик для мыши ограничивает движения в разгар игры. Значительно больший по размеру, чем другие коврики для мыши, Razer Gigantus дает вам пространство для маневров, особенно если вы играете при выбранной низкой чувствительности. На просторном коврике реже приходится поднимать и переносить мышь.

Специальное игровое покрытие — залог вашей скорости и точности
Razer Gigantus был создан для обеспечения мягкого скольжения и достаточной силы сопротивления, так что вы получите лучшее из обоих миров на поле боя. Ровная плоская текстурированная поверхность этого коврика нового поколения оптимизирована для высокой быстроты реакции на отслеживание перемещений, предоставляя максимальную точность, которая так нужна всем профессиональным геймерам.

Увеличенная толщина для однородной поверхности
Плотная пена толщиной 5 мм, из которой сделан Razer Gigantus, и прорезиненное основание не дают ему смещаться даже на не самой совершенной поверхности. Этот коврик даст надёжное основание для точных движений мышкой.
",Ткань,Резина,455x455x5 мм,Очень большой размер для игры на низких разрешениях.Прошитые края для защиты от износа.
"RZ02-01070100-R3M2/1.jpg///RZ02-01070100-R3M2/2.png///RZ02-01070100-R3M2/3.png///RZ02-01070100-R3M2/4.png///RZ02-01070100-R3M2/5.png
",Девайсы///Коврики для мыши,Razer,RZ02-01070100-R3M2,Razer Goliathus Speed Terra Small,RZ02-01070100-R3M2,"Коврик Razer Goliathus Speed Terra Edition, протестированный в лабораториях Razer и проверенный на практике лучшими игроками eSports, представляет собой идеально гладкую поверхность, на которой ничто не помешает движению игровой мыши.

Гладкая поверхность и плотное переплетение — основа СКОРОСТИ в игре
Нити тканого покрытия у Razer Goliathus Speed Terra Edition сплетены настолько плотно, что в итоге создается идеально гладкая поверхность, по которой игровая мышь скользит предельно быстро. Кроме того, покрытие очень приятно на ощупь, и рука будет меньше уставать во время продолжительной игры.

Оптимальная поддержка всех видов сенсоров и всех параметров чувствительности
Низкая или высокая чувствительность, лазерная или оптическая игровая мышь — при любом раскладе Razer Goliathus Speed Terra Edition обеспечит качественное считывание сигнала и стабильность управления в игре.

",Ткань,Резина,270 x 215 x 3 мм,"Плотное и гладкое переплетение нитей для скоростных движений
Попиксельная точность прицеливания и отслеживания
Оптимальное покрытие для всех уровней чувствительности и всех видов сенсоровSmall (Маленький) - 270 x 215 x 3 мм"
"RZ02-01070200-R3M2/1.png///RZ02-01070200-R3M2/2.png///RZ02-01070200-R3M2/3.png///RZ02-01070200-R3M2/4.png///RZ02-01070200-R3M2/5.png
",Девайсы///Коврики для мыши,Razer,RZ02-01070200-R3M2,Razer Goliathus Speed Terra Medium,RZ02-01070200-R3M2,"Коврик Razer Goliathus Speed Terra Edition, протестированный в лабораториях Razer и проверенный на практике лучшими игроками eSports, представляет собой идеально гладкую поверхность, на которой ничто не помешает движению игровой мыши.

Гладкая поверхность и плотное переплетение — основа СКОРОСТИ в игре
Нити тканого покрытия у Razer Goliathus Speed Terra Edition сплетены настолько плотно, что в итоге создается идеально гладкая поверхность, по которой игровая мышь скользит предельно быстро. Кроме того, покрытие очень приятно на ощупь, и рука будет меньше уставать во время продолжительной игры.

Оптимальная поддержка всех видов сенсоров и всех параметров чувствительности
Низкая или высокая чувствительность, лазерная или оптическая игровая мышь — при любом раскладе Razer Goliathus Speed Terra Edition обеспечит качественное считывание сигнала и стабильность управления в игре.

",Ткань,Резина,355 x 254 x 3 мм,"Плотное и гладкое переплетение нитей для скоростных движений
Попиксельная точность прицеливания и отслеживания
Оптимальное покрытие для всех уровней чувствительности и всех видов сенсоровMedium (Средний) - 355 x 254 x 3 мм"
